<?xml version="1.0" encoding="UTF-8"?>
<i:CodeMappings id="structured" xmlns:i="http://TheInPUT.org/CodeMappings" xmlns:i1="http://TheInPUT.org/DesignSpace" xmlns:xsi="http://www.w3.org/2001/XMLSchema-instance" xsi:schemaLocation="http://TheInPUT.org/CodeMappings http://TheInPUT.org/CodeMappings.xsd ">
<i:Mapping id="Decision" type="se.miun.itm.input.example.structured.model.Decision"/>
<i:Mapping id="Decision.FirstChoice" type="se.miun.itm.input.example.structured.model.FirstChoice"/>
<i:Mapping id="Decision.SecondChoice" type="se.miun.itm.input.example.structured.model.SecondChoice"/>
<i:Mapping id="Decision.ThirdChoice" type="se.miun.itm.input.example.structured.model.ThirdChoice"/>

<i:Mapping id="AnotherDecision" type="se.miun.itm.input.example.structured.model.AnotherDecision"/>
<i:Mapping id="AnotherDecision.Raw" type="se.miun.itm.input.example.structured.model.Raw"/>
<i:Mapping id="AnotherDecision.Medium" type="se.miun.itm.input.example.structured.model.Medium"/>
<i:Mapping id="AnotherDecision.WellDone" type="se.miun.itm.input.example.structured.model.WellDone"/>
</i:CodeMappings>
