<?xml version="1.0" encoding="UTF-8"?>
<i:CodeMappings id="combined" xmlns:i="http://TheInPUT.org/CodeMappings"
	xmlns:i1="http://TheInPUT.org/DesignSpace" xmlns:xsi="http://www.w3.org/2001/XMLSchema-instance"
	xsi:schemaLocation="http://TheInPUT.org/CodeMappings http://theinput.org/CodeMappings.xsd ">
	<i:Mapping id="SomeStructuralParent" type="model.SomeStructuralParent"
		constructor="SomeSharedPrimitiveSub" />
	<i:Mapping id="SomeStructuralParent.YetAnotherFirstChoice"
		type="model.YetAnotherFirstChoice" />
	<i:Mapping id="SomeStructuralParent.YetAnotherSecondChoice"
		type="model.YetAnotherSecondChoice" constructor="" />
	<i:Mapping id="SomeStructuralParent.YetAnotherThirdChoice"
		type="model.YetAnotherThirdChoice" constructor="SomeSharedPrimitiveSub SomeChoiceSpecificPrimitiveSub" />
	<i:Mapping id="SomeIrrelevantParameter" type="model.SomeStructuralParent"
		constructor="SomeSharedPrimitiveSub" />
	<i:Mapping id="AnotherStructural" type="model.AnotherStructural" />
	<i:Mapping id="AnotherStructural.AnotherFirstChoice" type="FIRST" />

	<i:Mapping id="SomeComplexStructural" type="model.SomeAbstractComplexStructural">
		<i:Complex type="model.SomeComplexStructural" add="addEntry" />
	</i:Mapping>
	<i:Mapping id="SomeComplexStructural.FirstChoice" type="model.SingleComplexChoice" constructor="A" />
	<i:Mapping id="SomeComplexStructural.SecondChoice" type="model.SingleComplexChoice" />
	
	<i:Mapping id="SomeFixedSingleArrayStructural" type="model.SomeAbstractComplexStructural"/>
	<i:Mapping id="SomeFixedSingleArrayStructural.FirstChoice" type="model.SingleComplexChoice" constructor="A" />
	<i:Mapping id="SomeFixedSingleArrayStructural.SecondChoice" type="model.SingleComplexChoice" />
</i:CodeMappings>