<?xml version="1.0" encoding="UTF-8"?>
<i:CodeMappings id="structural" xmlns:i="http://TheInPUT.org/CodeMappings"
	xmlns:i1="http://TheInPUT.org/DesignSpace" xmlns:xsi="http://www.w3.org/2001/XMLSchema-instance"
	xsi:schemaLocation="http://TheInPUT.org/CodeMappings http://theinput.org/CodeMappings.xsd ">
	
	<i:Mapping id="SomeStructural" type="model.SomeStructural" />
	<i:Mapping id="SomeStructural.FirstChoice" type="model.SomeFirstChoice" />
	<i:Mapping id="SomeStructural.SecondChoice" type="model.SomeSecondChoice" />
	<i:Mapping id="SomeStructural.ThirdChoice" type="model.SomeThirdChoice" />
	
	
		<i:Mapping id="SomeStructuralParent" type="model.SomeStructuralParent"
		constructor="SomeSharedPrimitiveSub" />
	<i:Mapping id="SomeStructuralParent.YetAnotherFirstChoice"
		type="model.YetAnotherFirstChoice" />
	<i:Mapping id="SomeStructuralParent.YetAnotherSecondChoice"
		type="model.YetAnotherSecondChoice" constructor="" />
	<i:Mapping id="SomeStructuralParent.YetAnotherThirdChoice"
		type="model.YetAnotherThirdChoice" constructor="SomeSharedPrimitiveSub SomeChoiceSpecificPrimitiveSub" />
		
</i:CodeMappings>