<?xml version="1.0" encoding="UTF-8"?>
<i:CodeMappings id="structuredAdv" xmlns:i="http://TheInPUT.org/CodeMappings" xmlns:i1="http://TheInPUT.org/DesignSpace" xmlns:xsi="http://www.w3.org/2001/XMLSchema-instance" xsi:schemaLocation="http://TheInPUT.org/CodeMappings http://TheInPUT.org/CodeMappings.xsd ">
<i:Mapping id="Steak" type="se.miun.itm.input.example.structured.model.AnotherDecision"/>
<i:Mapping id="Steak.Raw" type="se.miun.itm.input.example.structured.model.Raw"/>
<i:Mapping id="Steak.Medium" type="se.miun.itm.input.example.structured.model.Medium"/>
<i:Mapping id="Steak.WellDone" type="se.miun.itm.input.example.structured.model.WellDone"/>

<i:Mapping id="Steak.Medium.Rather" type="se.miun.itm.input.example.structured.model.AnotherDecision"/>
<i:Mapping id="Steak.Medium.Rather.Raw" type="se.miun.itm.input.example.structured.model.Raw"/>
<i:Mapping id="Steak.Medium.Rather.WellDone" type="se.miun.itm.input.example.structured.model.WellDone"/>

</i:CodeMappings>
